{
  "specVersion": "1.0",
  "catalogVersion": "4d2bf6b7f7fcd781",
  "meta": {
    "project": "hoverSink-candidate",
    "target": "vanilla-gsap",
    "createdWith": "wave-d"
  },
  "globals": {
    "respectReducedMotion": true
  },
  "motions": [
    {
      "id": "hoverSink-1",
      "primitive": "hoverSink",
      "target": ".d-hoverSink",
      "params": {
        "distance": "4px",
        "duration": 0.2
      }
    }
  ]
}
