{
  "specVersion": "1.0",
  "catalogVersion": "a0a405b4556fcab4",
  "meta": {
    "project": "hoverGrow-candidate",
    "target": "vanilla-gsap",
    "createdWith": "wave-c"
  },
  "globals": {
    "respectReducedMotion": true
  },
  "motions": [
    {
      "id": "hoverGrow-1",
      "primitive": "hoverGrow",
      "target": ".d-hoverGrow",
      "params": {
        "scale": 1.08,
        "duration": 0.2
      }
    }
  ]
}
