{
  "specVersion": "1.0",
  "catalogVersion": "a0a405b4556fcab4",
  "meta": {
    "project": "swingLoop-candidate",
    "target": "vanilla-gsap",
    "createdWith": "wave-c"
  },
  "globals": {
    "respectReducedMotion": true
  },
  "motions": [
    {
      "id": "swingLoop-1",
      "primitive": "swingLoop",
      "target": ".d-swingLoop",
      "params": {
        "angle": 10,
        "duration": 2
      }
    }
  ]
}
