{
  "specVersion": "1.0",
  "catalogVersion": "3fb558c0786b33fb",
  "meta": {
    "project": "kenBurns-candidate",
    "target": "vanilla-gsap",
    "createdWith": "wave-b"
  },
  "globals": {
    "respectReducedMotion": true
  },
  "motions": [
    {
      "id": "kenBurns-1",
      "primitive": "kenBurns",
      "target": ".d-kenBurns",
      "params": {
        "scale": 1.15,
        "duration": 12
      }
    }
  ]
}
