{
  "specVersion": "1.0",
  "catalogVersion": "951874ddfc911d78",
  "meta": {
    "project": "swayLoop-candidate",
    "target": "vanilla-gsap",
    "createdWith": "wave-a"
  },
  "globals": {
    "respectReducedMotion": true
  },
  "motions": [
    {
      "id": "swayLoop-1",
      "primitive": "swayLoop",
      "target": ".d-swayLoop",
      "params": {
        "angle": 4,
        "duration": 4
      }
    }
  ]
}
