{
  "specVersion": "1.0",
  "catalogVersion": "4d2bf6b7f7fcd781",
  "meta": {
    "project": "wobbleLoop-candidate",
    "target": "vanilla-gsap",
    "createdWith": "wave-d"
  },
  "globals": {
    "respectReducedMotion": true
  },
  "motions": [
    {
      "id": "wobbleLoop-1",
      "primitive": "wobbleLoop",
      "target": ".d-wobbleLoop",
      "params": {
        "distance": "8px",
        "angle": 4,
        "duration": 1.5
      }
    }
  ]
}
