{
  "specVersion": "1.0",
  "catalogVersion": "951874ddfc911d78",
  "meta": {
    "project": "spinLoop-candidate",
    "target": "vanilla-gsap",
    "createdWith": "wave-a"
  },
  "globals": {
    "respectReducedMotion": true
  },
  "motions": [
    {
      "id": "spinLoop-1",
      "primitive": "spinLoop",
      "target": ".d-spinLoop",
      "params": {
        "duration": 6,
        "direction": "normal"
      }
    }
  ]
}
